<?xml version="1.0" encoding="UTF-8"?>
<tns:Cakes 
	xmlns:tns="http://www.example.org/confectionery_main" 
	xmlns:xsi="http://www.w3.org/2001/XMLSchema-instance" 
	xsi:schemaLocation="http://www.example.org/confectionery_main confectionery.xsd">
  <Order>
    <Id>1</Id>
    <OrderStatus>
      <Id>1</Id>
      <StatusName>Delivered</StatusName>
    </OrderStatus>
    <PaymentType>
      <Id>1</Id>
      <PaymentName>Card</PaymentName>
    </PaymentType>
    <OrderDate>2001-01-01</OrderDate>
    <DeliveryClient>
      <Id>1</Id>
      <FirstName>FirstName</FirstName>
      <LastName>LastName</LastName>
      <Contact>
        <Email>Email</Email>
      </Contact>
      <RegistrationDate>2001-01-01</RegistrationDate>
      <Discount>0.0</Discount>
      <Gender>
        <Id>1</Id>
        <PaymentName>Male</PaymentName>
      </Gender>
    </DeliveryClient>
    <SendingClient>
      <Id>1</Id>
      <FirstName>FirstName</FirstName>
      <LastName>LastName</LastName>
      <Contact>
        <Email>Email</Email>
      </Contact>
      <RegistrationDate>2001-01-01</RegistrationDate>
      <Discount>0.0</Discount>
      <Gender>
        <Id>1</Id>
        <PaymentName>Male</PaymentName>
      </Gender>
    </SendingClient>
    <DeliveryDepartment>
      <Id>1</Id>
      <Name>Name</Name>
      <City>City</City>
    </DeliveryDepartment>
    <SendingDepartment>
      <Id>1</Id>
      <Name>Name</Name>
      <City>City</City>
    </SendingDepartment>
    <Product>
      <Name>Name</Name>
      <Width>0.0</Width>
      <Height>0.0</Height>
      <Long>0.0</Long>
      <Weight>0.0</Weight>
    </Product>
  </Order>
  <Order>
    <Id>2</Id>
    <OrderStatus>
      <Id>2</Id>
      <StatusName>UnDelivered</StatusName>
    </OrderStatus>
    <PaymentType>
      <Id>2</Id>
      <PaymentName>Cach</PaymentName>
    </PaymentType>
    <OrderDate>2001-01-01</OrderDate>
    <DeliveryClient>
      <Id>2</Id>
      <FirstName>FirstName</FirstName>
      <LastName>LastName</LastName>
      <Contact>
        <Email>Email</Email>
      </Contact>
      <RegistrationDate>2001-01-01</RegistrationDate>
      <Discount>0.0</Discount>
      <Gender>
        <Id>1</Id>
        <PaymentName>Male</PaymentName>
      </Gender>
    </DeliveryClient>
    <SendingClient>
      <Id>2</Id>
      <FirstName>FirstName</FirstName>
      <LastName>LastName</LastName>
      <Contact>
        <Email>"Email@email.com"</Email>
      </Contact>
      <RegistrationDate>2001-01-01</RegistrationDate>
      <Discount>0.0</Discount>
      <Gender>
        <Id>2</Id>
        <PaymentName>Male</PaymentName>
      </Gender>
    </SendingClient>
    <DeliveryDepartment>
      <Id>2</Id>
      <Name>Name</Name>
      <City>City</City>
    </DeliveryDepartment>
    <SendingDepartment>
      <Id>2</Id>
      <Name>Name</Name>
      <City>City</City>
    </SendingDepartment>
    <Product>
      <Name>Name</Name>
      <Width>0.0</Width>
      <Height>0.0</Height>
      <Long>0.0</Long>
      <Weight>0.0</Weight>
    </Product>
  </Order>
</tns:Cakes>
